{
  "schema_version": "0.1.0",
  "run_id": "RUN-OFS003-PILOT-004",
  "evaluated_at": "2026-08-23T19:26:11.239529Z",
  "status": "failed",
  "publication_blocked": true,
  "window": {
    "started_at": "2026-08-23T19:10:13.082236Z",
    "ended_at": "2026-08-23T19:17:05.057008Z",
    "maximum_clock_skew_seconds": 60
  },
  "observation_count": 847,
  "anomaly_count": 192,
  "anomalies": [
    {
      "document_ref": "runs/RUN-OFS003-PILOT-004/manifest.json",
      "pointer": "$.query_receipts[0].executed_at",
      "event_key": "executed_at",
      "value": "2026-08-23T19:45:00Z",
      "reason": "after-run-window",
      "offset_seconds": 1674.942992
    },
    {
      "document_ref": "runs/RUN-OFS003-PILOT-004/manifest.json",
      "pointer": "$.query_receipts[1].executed_at",
      "event_key": "executed_at",
      "value": "2026-08-23T19:45:00Z",
      "reason": "after-run-window",
      "offset_seconds": 1674.942992
    },
    {
      "document_ref": "runs/RUN-OFS003-PILOT-004/manifest.json",
      "pointer": "$.query_receipts[2].executed_at",
      "event_key": "executed_at",
      "value": "2026-08-23T19:45:00Z",
      "reason": "after-run-window",
      "offset_seconds": 1674.942992
    },
    {
      "document_ref": "runs/RUN-OFS003-PILOT-004/manifest.json",
      "pointer": "$.query_receipts[3].executed_at",
      "event_key": "executed_at",
      "value": "2026-08-23T19:45:00Z",
      "reason": "after-run-window",
      "offset_seconds": 1674.942992
    },
    {
      "document_ref": "runs/RUN-OFS003-PILOT-004/manifest.json",
      "pointer": "$.query_receipts[4].executed_at",
      "event_key": "executed_at",
      "value": "2026-08-23T19:45:00Z",
      "reason": "after-run-window",
      "offset_seconds": 1674.942992
    },
    {
      "document_ref": "runs/RUN-OFS003-PILOT-004/manifest.json",
      "pointer": "$.query_receipts[5].executed_at",
      "event_key": "executed_at",
      "value": "2026-08-23T19:45:00Z",
      "reason": "after-run-window",
      "offset_seconds": 1674.942992
    },
    {
      "document_ref": "runs/RUN-OFS003-PILOT-004/manifest.json",
      "pointer": "$.query_receipts[6].executed_at",
      "event_key": "executed_at",
      "value": "2026-08-23T19:45:00Z",
      "reason": "after-run-window",
      "offset_seconds": 1674.942992
    },
    {
      "document_ref": "runs/RUN-OFS003-PILOT-004/manifest.json",
      "pointer": "$.query_receipts[7].executed_at",
      "event_key": "executed_at",
      "value": "2026-08-23T19:45:00Z",
      "reason": "after-run-window",
      "offset_seconds": 1674.942992
    },
    {
      "document_ref": "runs/RUN-OFS003-PILOT-004/manifest.json",
      "pointer": "$.query_receipts[8].executed_at",
      "event_key": "executed_at",
      "value": "2026-08-23T19:45:00Z",
      "reason": "after-run-window",
      "offset_seconds": 1674.942992
    },
    {
      "document_ref": "runs/RUN-OFS003-PILOT-004/manifest.json",
      "pointer": "$.query_receipts[9].executed_at",
      "event_key": "executed_at",
      "value": "2026-08-23T19:45:00Z",
      "reason": "after-run-window",
      "offset_seconds": 1674.942992
    },
    {
      "document_ref": "runs/RUN-OFS003-PILOT-004/manifest.json",
      "pointer": "$.query_receipts[10].executed_at",
      "event_key": "executed_at",
      "value": "2026-08-23T19:45:00Z",
      "reason": "after-run-window",
      "offset_seconds": 1674.942992
    },
    {
      "document_ref": "runs/RUN-OFS003-PILOT-004/manifest.json",
      "pointer": "$.query_receipts[11].executed_at",
      "event_key": "executed_at",
      "value": "2026-08-23T19:45:00Z",
      "reason": "after-run-window",
      "offset_seconds": 1674.942992
    },
    {
      "document_ref": "runs/RUN-OFS003-PILOT-004/manifest.json",
      "pointer": "$.query_receipts[12].executed_at",
      "event_key": "executed_at",
      "value": "2026-08-23T19:45:00Z",
      "reason": "after-run-window",
      "offset_seconds": 1674.942992
    },
    {
      "document_ref": "runs/RUN-OFS003-PILOT-004/manifest.json",
      "pointer": "$.query_receipts[13].executed_at",
      "event_key": "executed_at",
      "value": "2026-08-23T19:45:00Z",
      "reason": "after-run-window",
      "offset_seconds": 1674.942992
    },
    {
      "document_ref": "runs/RUN-OFS003-PILOT-004/manifest.json",
      "pointer": "$.query_receipts[14].executed_at",
      "event_key": "executed_at",
      "value": "2026-08-23T19:45:00Z",
      "reason": "after-run-window",
      "offset_seconds": 1674.942992
    },
    {
      "document_ref": "runs/RUN-OFS003-PILOT-004/manifest.json",
      "pointer": "$.query_receipts[15].executed_at",
      "event_key": "executed_at",
      "value": "2026-08-23T19:45:00Z",
      "reason": "after-run-window",
      "offset_seconds": 1674.942992
    },
    {
      "document_ref": "runs/RUN-OFS003-PILOT-004/manifest.json",
      "pointer": "$.query_receipts[16].executed_at",
      "event_key": "executed_at",
      "value": "2026-08-23T19:45:00Z",
      "reason": "after-run-window",
      "offset_seconds": 1674.942992
    },
    {
      "document_ref": "runs/RUN-OFS003-PILOT-004/manifest.json",
      "pointer": "$.query_receipts[17].executed_at",
      "event_key": "executed_at",
      "value": "2026-08-23T19:45:00Z",
      "reason": "after-run-window",
      "offset_seconds": 1674.942992
    },
    {
      "document_ref": "runs/RUN-OFS003-PILOT-004/manifest.json",
      "pointer": "$.query_receipts[18].executed_at",
      "event_key": "executed_at",
      "value": "2026-08-23T19:45:00Z",
      "reason": "after-run-window",
      "offset_seconds": 1674.942992
    },
    {
      "document_ref": "runs/RUN-OFS003-PILOT-004/manifest.json",
      "pointer": "$.query_receipts[19].executed_at",
      "event_key": "executed_at",
      "value": "2026-08-23T19:45:00Z",
      "reason": "after-run-window",
      "offset_seconds": 1674.942992
    },
    {
      "document_ref": "runs/RUN-OFS003-PILOT-004/manifest.json",
      "pointer": "$.query_receipts[20].executed_at",
      "event_key": "executed_at",
      "value": "2026-08-23T19:45:00Z",
      "reason": "after-run-window",
      "offset_seconds": 1674.942992
    },
    {
      "document_ref": "runs/RUN-OFS003-PILOT-004/manifest.json",
      "pointer": "$.query_receipts[21].executed_at",
      "event_key": "executed_at",
      "value": "2026-08-23T19:45:00Z",
      "reason": "after-run-window",
      "offset_seconds": 1674.942992
    },
    {
      "document_ref": "runs/RUN-OFS003-PILOT-004/manifest.json",
      "pointer": "$.query_receipts[22].executed_at",
      "event_key": "executed_at",
      "value": "2026-08-23T19:45:00Z",
      "reason": "after-run-window",
      "offset_seconds": 1674.942992
    },
    {
      "document_ref": "runs/RUN-OFS003-PILOT-004/manifest.json",
      "pointer": "$.query_receipts[23].executed_at",
      "event_key": "executed_at",
      "value": "2026-08-23T19:45:00Z",
      "reason": "after-run-window",
      "offset_seconds": 1674.942992
    },
    {
      "document_ref": "runs/RUN-OFS003-PILOT-004/manifest.json",
      "pointer": "$.query_receipts[24].executed_at",
      "event_key": "executed_at",
      "value": "2026-08-23T19:45:00Z",
      "reason": "after-run-window",
      "offset_seconds": 1674.942992
    },
    {
      "document_ref": "runs/RUN-OFS003-PILOT-004/manifest.json",
      "pointer": "$.query_receipts[25].executed_at",
      "event_key": "executed_at",
      "value": "2026-08-23T19:45:00Z",
      "reason": "after-run-window",
      "offset_seconds": 1674.942992
    },
    {
      "document_ref": "runs/RUN-OFS003-PILOT-004/manifest.json",
      "pointer": "$.query_receipts[26].executed_at",
      "event_key": "executed_at",
      "value": "2026-08-23T19:45:00Z",
      "reason": "after-run-window",
      "offset_seconds": 1674.942992
    },
    {
      "document_ref": "runs/RUN-OFS003-PILOT-004/manifest.json",
      "pointer": "$.query_receipts[27].executed_at",
      "event_key": "executed_at",
      "value": "2026-08-23T19:45:00Z",
      "reason": "after-run-window",
      "offset_seconds": 1674.942992
    },
    {
      "document_ref": "runs/RUN-OFS003-PILOT-004/manifest.json",
      "pointer": "$.query_receipts[28].executed_at",
      "event_key": "executed_at",
      "value": "2026-08-23T19:45:00Z",
      "reason": "after-run-window",
      "offset_seconds": 1674.942992
    },
    {
      "document_ref": "runs/RUN-OFS003-PILOT-004/manifest.json",
      "pointer": "$.query_receipts[29].executed_at",
      "event_key": "executed_at",
      "value": "2026-08-23T19:45:00Z",
      "reason": "after-run-window",
      "offset_seconds": 1674.942992
    },
    {
      "document_ref": "runs/RUN-OFS003-PILOT-004/manifest.json",
      "pointer": "$.query_receipts[30].executed_at",
      "event_key": "executed_at",
      "value": "2026-08-23T19:45:00Z",
      "reason": "after-run-window",
      "offset_seconds": 1674.942992
    },
    {
      "document_ref": "runs/RUN-OFS003-PILOT-004/manifest.json",
      "pointer": "$.query_receipts[31].executed_at",
      "event_key": "executed_at",
      "value": "2026-08-23T19:45:00Z",
      "reason": "after-run-window",
      "offset_seconds": 1674.942992
    },
    {
      "document_ref": "runs/RUN-OFS003-PILOT-004/manifest.json",
      "pointer": "$.query_receipts[32].executed_at",
      "event_key": "executed_at",
      "value": "2026-08-23T19:45:00Z",
      "reason": "after-run-window",
      "offset_seconds": 1674.942992
    },
    {
      "document_ref": "runs/RUN-OFS003-PILOT-004/manifest.json",
      "pointer": "$.query_receipts[33].executed_at",
      "event_key": "executed_at",
      "value": "2026-08-23T19:45:00Z",
      "reason": "after-run-window",
      "offset_seconds": 1674.942992
    },
    {
      "document_ref": "runs/RUN-OFS003-PILOT-004/manifest.json",
      "pointer": "$.query_receipts[34].executed_at",
      "event_key": "executed_at",
      "value": "2026-08-23T19:45:00Z",
      "reason": "after-run-window",